{
  "id": "terre",
  "name": "Terre",
  "treeType": "domain",
  "size": 16,
  "core": {
    "label": "Terre",
    "sublabel": "Domaine",
    "domains": [
      "earth"
    ],
    "pos": {
      "x": 50,
      "y": 50.81
    }
  },
  "nodes": [
    {
      "id": "PBBLE-01",
      "title": "Roche",
      "type": "active",
      "tier": 1,
      "domains": [
        "earth"
      ],
      "description": "Vous créez, remodelez, déplacez ou absorbez jusqu'à 10 cm³ de terre, de pierre ou de matière végétale que vous voyez, soit de quoi remplir vos deux mains. Utilisé de façon offensive, cette matière inflige jusqu'à 1d10 dégâts appropriés à sa forme. Chaque portée, zone, durée ou effet supplémentaire que vous lui donnez réduit d'autant ces dégâts, jusqu'à rendre le sort inoffensif. Si ce sort provoque un Jet de Sauvegarde, la base de votre DD est de 15.",
      "pos": {
        "x": 50,
        "y": 40
      },
      "linked": [
        "CORE"
      ],
      "activation": "1 Action",
      "range": "9 m",
      "duration": "Instantanée ou jusqu'à 10 minutes",
      "energy": 1,
      "tags": [
        "Sort",
        "Déchaîné"
      ],
      "characteristics": [
        "intelligence",
        "spirit",
        "charisma"
      ]
    },
    {
      "id": "PBBLE-02",
      "title": "Terreau",
      "type": "evolution",
      "tier": 3,
      "domains": [
        "earth"
      ],
      "description": "Lorsque vous utilisez Roche, vous pouvez dépenser 1 Énergie de plus pour lancer Terreau. Terreau agit exactement comme Roche, mais la matière peut désormais atteindre 50 cm³, soit environ une petite caisse. Ses dégâts maximaux passent à 2d10 et la base de son DD passe à 16.",
      "pos": {
        "x": 50,
        "y": 28
      },
      "linked": [
        "PBBLE-01"
      ],
      "activation": "—",
      "range": "—",
      "duration": "—",
      "tags": [
        "Sort",
        "Déchaîné"
      ],
      "evolvesFrom": "PBBLE-01",
      "characteristics": [
        "intelligence",
        "spirit",
        "charisma"
      ]
    },
    {
      "id": "PBBLE-03",
      "title": "Glaise",
      "type": "evolution",
      "tier": 5,
      "domains": [
        "earth"
      ],
      "description": "Lorsque vous utilisez Roche, vous pouvez dépenser 2 Énergies de plus pour lancer Glaise. Glaise agit exactement comme Roche, mais la matière peut désormais atteindre 0,5 m³, soit environ un coffre. Ses dégâts maximaux passent à 3d10 et la base de son DD passe à 17.",
      "pos": {
        "x": 64,
        "y": 23
      },
      "linked": [
        "PBBLE-02"
      ],
      "activation": "—",
      "range": "—",
      "duration": "—",
      "tags": [
        "Sort",
        "Déchaîné"
      ],
      "evolvesFrom": "PBBLE-02",
      "characteristics": [
        "intelligence",
        "spirit",
        "charisma"
      ]
    },
    {
      "id": "PBBLE-04",
      "title": "Souche",
      "type": "evolution",
      "tier": 7,
      "domains": [
        "earth"
      ],
      "description": "Lorsque vous utilisez Roche, vous pouvez dépenser 3 Énergies de plus pour lancer Souche. Souche agit exactement comme Roche, mais la matière peut désormais atteindre 1 m³, soit environ un tonneau. Ses dégâts maximaux passent à 4d10 et la base de son DD passe à 18.",
      "pos": {
        "x": 75,
        "y": 34
      },
      "linked": [
        "PBBLE-03"
      ],
      "activation": "—",
      "range": "—",
      "duration": "—",
      "tags": [
        "Sort",
        "Déchaîné"
      ],
      "evolvesFrom": "PBBLE-03",
      "characteristics": [
        "intelligence",
        "spirit",
        "charisma"
      ]
    },
    {
      "id": "PBBLE-05",
      "title": "Tertre",
      "type": "evolution",
      "tier": 9,
      "domains": [
        "earth"
      ],
      "description": "Lorsque vous utilisez Roche, vous pouvez dépenser 4 Énergies de plus pour lancer Tertre. Tertre agit exactement comme Roche, mais la matière peut désormais atteindre 5 m³, soit environ une charrette. Ses dégâts maximaux passent à 5d10 et la base de son DD passe à 19.",
      "pos": {
        "x": 78,
        "y": 50
      },
      "linked": [
        "PBBLE-04"
      ],
      "activation": "—",
      "range": "—",
      "duration": "—",
      "tags": [
        "Sort",
        "Déchaîné"
      ],
      "evolvesFrom": "PBBLE-04",
      "characteristics": [
        "intelligence",
        "spirit",
        "charisma"
      ]
    },
    {
      "id": "PBBLE-06",
      "title": "Colline",
      "type": "evolution",
      "tier": 10,
      "domains": [
        "earth"
      ],
      "description": "Lorsque vous utilisez Roche, vous pouvez dépenser 5 Énergies de plus pour lancer Colline. Colline agit exactement comme Roche, mais la matière peut désormais atteindre 10 m³, soit environ une pièce. Ses dégâts maximaux passent à 6d10 et la base de son DD passe à 20.",
      "pos": {
        "x": 72,
        "y": 65
      },
      "linked": [
        "PBBLE-05"
      ],
      "activation": "—",
      "range": "—",
      "duration": "—",
      "tags": [
        "Sort",
        "Déchaîné"
      ],
      "evolvesFrom": "PBBLE-05",
      "characteristics": [
        "intelligence",
        "spirit",
        "charisma"
      ]
    },
    {
      "id": "PHTST-01",
      "title": "Photosynthèse",
      "type": "active",
      "tier": 4,
      "domains": [
        "earth",
        "light"
      ],
      "description": "Vous accélérez brutalement la croissance d'une graine, d'une pousse, d'une plante, d'un arbre ou d'une créature végétale à portée, la faisant atteindre sa pleine maturité naturelle en quelques instants. Une graine plantée peut ainsi devenir un arbre adulte.",
      "pos": {
        "x": 37,
        "y": 21
      },
      "linked": [
        "PBBLE-02"
      ],
      "activation": "1 Action",
      "range": "9 m",
      "duration": "Instantanée",
      "energy": 2,
      "tags": [
        "Sort",
        "Croissance"
      ]
    },
    {
      "id": "EARPD-01",
      "title": "Détection primordiale",
      "type": "passive",
      "tier": 3,
      "domains": [
        "earth",
        "psychic"
      ],
      "description": "Lorsque vous effectuez un Jet pour détecter, ressentir ou en apprendre plus sur un élément composé de magie de Terre, vous gagnez 1 Avantage pour ce Jet.",
      "pos": {
        "x": 26,
        "y": 32
      },
      "linked": [
        "PBBLE-02"
      ],
      "activation": "Passif",
      "range": "—",
      "duration": "—",
      "tags": [
        "Sort",
        "Divination"
      ]
    },
    {
      "id": "EARME-01",
      "title": "Étendue martiale",
      "type": "active",
      "tier": 2,
      "domains": [
        "earth",
        "physical"
      ],
      "description": "Vous touchez une arme et l'enveloppez d'une force minérale ou végétale pendant 1 minute. Une fois par tour, lorsque vous réussissez un Jet d'attaque avec celle-ci, lancez 1d100 : vous gagnez un montant de PV Temporaires égal à ce pourcentage des dégâts infligés par ce Jet d'attaque, jusqu'à un maximum de 50% des dégâts infligés.",
      "pos": {
        "x": 27,
        "y": 49
      },
      "linked": [
        "PBBLE-02"
      ],
      "activation": "1 Action Bonus",
      "range": "Contact",
      "duration": "1 minute",
      "energy": 1,
      "tags": [
        "Sort",
        "Enchantement"
      ]
    },
    {
      "id": "EARME-02",
      "title": "Étendue perfectionnée",
      "type": "evolution",
      "tier": 5,
      "domains": [
        "earth",
        "physical"
      ],
      "description": "Étendue martiale suit désormais la progression de Roche. Pour chaque évolution de Roche que vous possédez, le maximum de PV Temporaires que vous pouvez gagner grâce à Étendue martiale augmente de 10% des dégâts infligés.",
      "pos": {
        "x": 20,
        "y": 62
      },
      "linked": [
        "EARME-01"
      ],
      "activation": "—",
      "range": "—",
      "duration": "—",
      "tags": [
        "Sort",
        "Enchantement"
      ],
      "evolvesFrom": "EARME-01"
    }
  ]
}
